{
  "description": "rusty_sword resolves to the rig-native KayKit sword asset and right-hand socket via shared metadata + manifest (ADR-0018 P3a).",
  "item_def_id": "rusty_sword",
  "expected_asset_id": "kaykit_weapon_adv_sword_1handed_v0",
  "expected_mount_socket": "right_hand_socket",
  "expected_slot": "main_hand"
}
